[
  {
    "id": "swastik-mango-pickle",
    "name": "Swastik Mango Pickle",
    "brandId": "swastik",
    "category": "Pickles",
    "description": "Traditional spiced raw mango pickle aged in cold-pressed mustard oil with red chillies and fenugreek, sealed in a food-grade retail jar.",
    "price": 135,
    "sku": "SWA-PCK-MNG",
    "stock": 40,
    "pack": "300 g",
    "image": "/images/products/swastik-mango-pickle.svg",
    "active": true
  },
  {
    "id": "swastik-lime-pickle",
    "name": "Swastik Lime Pickle",
    "brandId": "swastik",
    "category": "Pickles",
    "description": "Tangy and spiced cured lime pickle prepared with aromatic spices and mustard oil in an airtight sealed retail container.",
    "price": 125,
    "sku": "SWA-PCK-LIM",
    "stock": 35,
    "pack": "300 g",
    "image": "/images/products/swastik-lime-pickle.svg",
    "active": true
  },
  {
    "id": "swastik-sambar-powder",
    "name": "Swastik Sambar Powder",
    "brandId": "swastik",
    "category": "Spice powders",
    "description": "Traditional South Indian sambar powder formulated with roasted coriander, toor dal, cumin, fenugreek, and select red chillies in a sealed retail pouch.",
    "price": 85,
    "sku": "SWA-MAS-SAM",
    "stock": 50,
    "pack": "200 g",
    "image": "/images/products/swastik-sambar-powder.svg",
    "active": true
  },
  {
    "id": "swastik-rasam-powder",
    "name": "Swastik Rasam Powder",
    "brandId": "swastik",
    "category": "Spice powders",
    "description": "Signature rasam powder loaded with roasted black peppercorns, cumin, and aromatic lentils in an airtight foil packet.",
    "price": 80,
    "sku": "SWA-MAS-RAS",
    "stock": 45,
    "pack": "200 g",
    "image": "/images/products/swastik-rasam-powder.svg",
    "active": true
  },
  {
    "id": "swastik-badam-powder",
    "name": "Swastik Badam Powder",
    "brandId": "swastik",
    "category": "Instant mixes",
    "description": "Nourishing almond beverage mix blended with crushed badam bits, green cardamom, and rich saffron essence in a sealed retail pack.",
    "price": 140,
    "sku": "SWA-MIX-BDM",
    "stock": 30,
    "pack": "200 g",
    "image": "/images/products/swastik-badam-powder.svg",
    "active": true
  },
  {
    "id": "swastik-rava-idli-mix",
    "name": "Swastik Rava Idli Mix",
    "brandId": "swastik",
    "category": "Instant mixes",
    "description": "Classic semolina breakfast mix tempered with mustard seeds, ginger, and curry leaves in a moisture-proof retail packet.",
    "price": 95,
    "sku": "SWA-MIX-RVA",
    "stock": 40,
    "pack": "500 g",
    "image": "/images/products/swastik-rava-idli-mix.svg",
    "active": true
  },
  {
    "id": "swastik-puliyogare-powder",
    "name": "Swastik Puliyogare Powder",
    "brandId": "swastik",
    "category": "Spice powders",
    "description": "Tangy tamarind rice masala blend containing roasted peanuts, white sesame, red chillies, and curry leaves in a sealed pouch.",
    "price": 85,
    "sku": "SWA-MAS-PLY",
    "stock": 30,
    "pack": "200 g",
    "image": "/images/products/swastik-puliyogare-powder.svg",
    "active": true
  },
  {
    "id": "swastik-gulab-jamun-mix",
    "name": "Swastik Gulab Jamun Mix",
    "brandId": "swastik",
    "category": "Instant mixes",
    "description": "Instant dessert mix for festive celebrations, packaged in a sealed retail pouch with easy preparation instructions.",
    "price": 110,
    "sku": "SWA-MIX-GJM",
    "stock": 50,
    "pack": "200 g",
    "image": "/images/products/swastik-gulab-jamun-mix.svg",
    "active": true
  },
  {
    "id": "swastik-roasted-vermicelli",
    "name": "Swastik Roasted Vermicelli",
    "brandId": "swastik",
    "category": "Pantry staples",
    "description": "Premium roasted wheat semiya, non-sticky and pre-roasted, packaged in a heat-sealed retail poly pack.",
    "price": 65,
    "sku": "SWA-STA-VRM",
    "stock": 60,
    "pack": "400 g",
    "image": "/images/products/swastik-roasted-vermicelli.svg",
    "active": true
  },
  {
    "id": "rala-chilli-powder",
    "name": "Rala Chilli Powder",
    "brandId": "rala",
    "category": "Spice powders",
    "description": "Pure single-origin ground red chillies processed under strict hygiene in a sealed retail spice packet.",
    "price": 120,
    "sku": "RAL-SP-CHL",
    "stock": 50,
    "pack": "200 g",
    "image": "/images/products/rala-chilli-powder.svg",
    "active": true
  },
  {
    "id": "rala-turmeric-powder",
    "name": "Rala Turmeric Powder",
    "brandId": "rala",
    "category": "Spice powders",
    "description": "High-curcumin golden turmeric rhizomes ground to silky fineness, packaged in an aroma-locking laminated pouch.",
    "price": 90,
    "sku": "RAL-SP-TRM",
    "stock": 55,
    "pack": "200 g",
    "image": "/images/products/rala-turmeric-powder.svg",
    "active": true
  },
  {
    "id": "rala-coriander-powder",
    "name": "Rala Coriander Powder",
    "brandId": "rala",
    "category": "Spice powders",
    "description": "Freshly pulverized whole coriander seeds offering a refreshing citrusy aroma, sealed in a retail packet.",
    "price": 85,
    "sku": "RAL-SP-COR",
    "stock": 45,
    "pack": "200 g",
    "image": "/images/products/rala-coriander-powder.svg",
    "active": true
  },
  {
    "id": "rala-chicken-masala",
    "name": "Rala Chicken Masala",
    "brandId": "rala",
    "category": "Blended masalas",
    "description": "Artisanal spice mixture formulated for rich chicken curry and roasts, packaged in a moisture-resistant retail packet.",
    "price": 95,
    "sku": "RAL-BL-CHK",
    "stock": 40,
    "pack": "100 g",
    "image": "/images/products/rala-chicken-masala.svg",
    "active": true
  },
  {
    "id": "rala-meat-masala",
    "name": "Rala Meat Masala",
    "brandId": "rala",
    "category": "Blended masalas",
    "description": "Hearty, pungent masala crafted for mutton and rich meat preparations, sealed in a branded retail spice pouch.",
    "price": 105,
    "sku": "RAL-BL-MEA",
    "stock": 35,
    "pack": "100 g",
    "image": "/images/products/rala-meat-masala.svg",
    "active": true
  },
  {
    "id": "rala-garam-masala",
    "name": "Rala Garam Masala",
    "brandId": "rala",
    "category": "Blended masalas",
    "description": "Balanced finishing spice blend uniting royal cumin, cinnamon, green cardamom, and cloves in a sealed packet.",
    "price": 150,
    "sku": "RAL-BL-GAR",
    "stock": 40,
    "pack": "100 g",
    "image": "/images/products/rala-garam-masala.svg",
    "active": true
  },
  {
    "id": "rala-kasuri-methi",
    "name": "Rala Kasuri Methi",
    "brandId": "rala",
    "category": "Herbs",
    "description": "Fragrant, shade-dried whole fenugreek leaves in a sealed retail box/pouch to retain herbal pungency.",
    "price": 65,
    "sku": "RAL-HB-MET",
    "stock": 50,
    "pack": "50 g",
    "image": "/images/products/rala-kasuri-methi.svg",
    "active": true
  },
  {
    "id": "monkey-555-grass-broom",
    "name": "Monkey 555 Deluxe Grass Broom",
    "brandId": "monkey-555",
    "category": "Cleaning tools",
    "description": "Premium natural Shillong hill grass broom with reinforced ergonomic handle grip and retail protective sleeve.",
    "price": 180,
    "sku": "MNK-CL-BRM",
    "stock": 60,
    "pack": "1 unit",
    "image": "/images/products/monkey-555-grass-broom.svg",
    "active": true
  },
  {
    "id": "monkey-555-cotton-mop",
    "name": "Monkey 555 Cotton Floor Mop",
    "brandId": "monkey-555",
    "category": "Cleaning tools",
    "description": "High-absorbency braided looped cotton yarn mop with sturdy handle socket and branded retail packaging wrap.",
    "price": 220,
    "sku": "MNK-CL-MOP",
    "stock": 45,
    "pack": "1 unit",
    "image": "/images/products/monkey-555-cotton-mop.svg",
    "active": true
  },
  {
    "id": "monkey-555-phenyl",
    "name": "Monkey 555 Floor Cleaner Phenyl",
    "brandId": "monkey-555",
    "category": "Cleaning liquids",
    "description": "Pine disinfectant floor cleaner in a heavy-duty 1 Litre plastic bottle with leak-proof ribbed safety cap.",
    "price": 95,
    "sku": "MNK-CL-PHN",
    "stock": 50,
    "pack": "1 L",
    "image": "/images/products/monkey-555-phenyl.svg",
    "active": true
  },
  {
    "id": "monkey-555-ozone-cleaner",
    "name": "Monkey 555 Ozone Surface Cleaner",
    "brandId": "monkey-555",
    "category": "Cleaning liquids",
    "description": "Multi-surface antibacterial cleaner in a 500 ml trigger spray bottle with adjustable mist nozzle.",
    "price": 130,
    "sku": "MNK-CL-OZN",
    "stock": 40,
    "pack": "500 ml",
    "image": "/images/products/monkey-555-ozone-cleaner.svg",
    "active": true
  },
  {
    "id": "monkey-555-bleaching-powder",
    "name": "Monkey 555 Bleaching Powder",
    "brandId": "monkey-555",
    "category": "Cleaning powders",
    "description": "High-grade disinfectant bleaching powder packed in a 1 kg heavy-duty laminated poly bag with safety seal.",
    "price": 85,
    "sku": "MNK-CL-BLC",
    "stock": 50,
    "pack": "1 kg",
    "image": "/images/products/monkey-555-bleaching-powder.svg",
    "active": true
  },
  {
    "id": "monkey-vvv-detergent-powder",
    "name": "Monkey VVV Active Detergent Powder",
    "brandId": "monkey-vvv",
    "category": "Laundry care",
    "description": "Enzyme-powered laundry washing powder in a sealed 1 kg retail pouch with top carry handle.",
    "price": 110,
    "sku": "VVV-LD-POW",
    "stock": 55,
    "pack": "1 kg",
    "image": "/images/products/monkey-vvv-detergent-powder.svg",
    "active": true
  },
  {
    "id": "monkey-vvv-dishwash-bar",
    "name": "Monkey VVV Dishwash Bar",
    "brandId": "monkey-vvv",
    "category": "Dish care",
    "description": "Hard grease-cutting dishwashing cake wrapped in a protective 250 g moisture-proof wrapper.",
    "price": 35,
    "sku": "VVV-DC-BAR",
    "stock": 70,
    "pack": "250 g",
    "image": "/images/products/monkey-vvv-dishwash-bar.svg",